SMILES,GENERIC_NAME,SYNONYMS
CC[C@H](C)[C@H](NC(=O)[C@H](CCC(=O)O)NC(=O)[C@H](CCC(=O)O)NC(=O)[C@H](Cc1ccccc1)NC(=O)[C@H](CC(=O)O)NC(=O)CNC(=O)[C@H](CC(N)=O)NC(=O)CNC(=O)CNC(=O)CNC(=O)CNC(=O)[C@@H]1CCCN1C(=O)[C@H](CCCNC(=N)N)NC(=O)[C@@H]1CCCN1C(=O)[C@H](N)Cc1ccccc1)C(=O)N1CCC[C@H]1C(=O)N[C@@H](CCC(=O)O)C(=O)N[C@@H](CCC(=O)O)C(=O)N[C@@H](Cc1ccc(O)cc1)C(=O)N[C@@H](CC(C)C)C(=O)O,Bivalirudin,Bivalirudin; Bivalirudina; Bivalirudinum
CC(C)C[C@H](NC(=O)[C@@H](COC(C)(C)C)NC(=O)[C@H](Cc1ccc(O)cc1)NC(=O)[C@H](CO)NC(=O)[C@H](Cc1c[nH]c2ccccc12)NC(=O)[C@H](Cc1cnc[nH]1)NC(=O)[C@@H]1CCC(=O)N1)C(=O)N[C@@H](CCCN=C(N)N)C(=O)N1CCC[C@H]1C(=O)NNC(N)=O,Goserelin,Goserelin; Goserelina
CC(C)C[C@@H](NC(=O)CNC(=O)[C@@H](NC=O)C(C)C)C(=O)N[C@@H](C)C(=O)N[C@@H](C(=O)N[C@H](C(=O)N[C@@H](C(=O)N[C@@H](Cc1c[nH]c2ccccc12)C(=O)N[C@H](CC(C)C)C(=O)N[C@@H](Cc1c[nH]c2ccccc12)C(=O)N[C@H](CC(C)C)C(=O)N[C@@H](Cc1c[nH]c2ccccc12)C(=O)N[C@H](CC(C)C)C(=O)N[C@@H](Cc1c[nH]c2ccccc12)C(=O)NCCO)C(C)C)C(C)C)C(C)C,Gramicidin D,Bacillus brevis gramicidin D; Gramicidin; Gramicidin A; Gramicidin B; Gramicidin C; Gramicidina; Gramicidine
N=C(N)NCCC[C@@H](NC(=O)[C@@H]1CCCN1C(=O)[C@@H]1CSSCCC(=O)N[C@@H](Cc2ccc(O)cc2)C(=O)N[C@@H](Cc2ccccc2)C(=O)N[C@@H](CCC(N)=O)C(=O)N[C@@H](CC(N)=O)C(=O)N1)C(=O)NCC(N)=O,Desmopressin,1-(3-mercaptopropionic acid)-8-D-arginine-vasopressin; 1-deamino-8-D-arginine vasopressin; 1-desamino-8-D-arginine vasopressin; dDAVP; Desmopresina; Desmopressin; Desmopressine; Desmopressinum
CC(=O)N[C@H](Cc1ccc2ccccc2c1)C(=O)N[C@H](Cc1ccc(Cl)cc1)C(=O)N[C@H](Cc1cccnc1)C(=O)N[C@@H](CO)C(=O)N[C@@H](Cc1ccc(O)cc1)C(=O)N[C@H](CCCNC(N)=O)C(=O)N[C@@H](CC(C)C)C(=O)N[C@@H](CCCNC(=N)N)C(=O)N1CCC[C@H]1C(=O)N[C@H](C)C(N)=O,Cetrorelix,Cetrorelix; Cetrorelixum
CCCCCCCCCC(=O)N[C@@H](Cc1c[nH]c2ccccc12)C(=O)N[C@H](CC(N)=O)C(=O)N[C@@H](CC(=O)O)C(=O)N[C@@H]1C(=O)NCC(=O)N[C@@H](CCCN)C(=O)N[C@@H](CC(=O)O)C(=O)N[C@H](C)C(=O)N[C@@H](CC(=O)O)C(=O)NCC(=O)N[C@H](CO)C(=O)N[C@@H]([C@H](C)CC(=O)O)C(=O)N[C@@H](CC(=O)c2ccccc2N)C(=O)O[C@@H]1C,Daptomycin,Daptomicina; Daptomycin; Daptomycine; Daptomycinum
C/C=C/C[C@@H](C)[C@@H](O)[C@H]1C(=O)N[C@@H](CC)C(=O)N(C)CC(=O)N(C)[C@@H](CC(C)C)C(=O)N[C@@H](C(C)C)C(=O)N(C)[C@@H](CC(C)C)C(=O)N[C@@H](C)C(=O)N[C@H](C)C(=O)N(C)[C@@H](CC(C)C)C(=O)N(C)[C@@H](CC(C)C)C(=O)N(C)[C@@H](C(C)C)C(=O)N1C,Cyclosporine,Ciclosporin; Ciclosporina; Ciclosporine; Ciclosporinum; CsA; CyA; Cyclosporin; Cyclosporin A; Cyclosporine
CC(=O)N[C@H](Cc1ccc2ccccc2c1)C(=O)N[C@H](Cc1ccc(Cl)cc1)C(=O)N[C@H](Cc1cccnc1)C(=O)N[C@@H](CO)C(=O)N(C)[C@@H](Cc1ccc(O)cc1)C(=O)N[C@H](CC(N)=O)C(=O)N[C@@H](CC(C)C)C(=O)N[C@@H](CCCCNC(C)C)C(=O)N1CCC[C@H]1C(=O)N[C@H](C)C(N)=O,Abarelix,Abarelix
Cc1ncc(COP(=O)(O)O)c(C=O)c1O,Pyridoxal phosphate,3-hydroxy-2-methyl-5-((phosphonooxy)methyl)-4-pyridinecarboxaldehyde; 3-hydroxy-5-(hydroxymethyl)-2-methylisonicotinaldehyde 5-phosphate; Codecarboxylase; PLP; Pyridoxal 5-monophosphoric acid ester; Pyridoxal 5-phosphate; Pyridoxal 5'-phosphate; Pyridoxal P; Pyridoxal phosphate anhydrous; Pyridoxal-5P; Pyridoxal-P
C/C1=C2/N=C(/C=C3\N=C(/C(C)=C4/[C@@H](CCC(N)=O)[C@](C)(CC(N)=O)[C@](C)([C@@H]5N=C1[C@](C)(CCC(=O)NC[C@@H](C)OP(=O)([O-])O[C@@H]1[C@@H](CO)O[C@H](n6cnc7cc(C)c(C)cc76)[C@@H]1O)[C@H]5CC(N)=O)N4[Co+]C#N)[C@@](C)(CC(N)=O)[C@@H]3CCC(N)=O)C(C)(C)[C@@H]2CCC(N)=O,Cyanocobalamin,Cianocobalamina; Cyanocob(III)alamin; Cyanocobalamin; Cyanocobalamine; Cyanocobalaminum; Vitamin B12; Vitamin B12 complex; Vitamin B12 NOS
C[S+](CC[C@H](N)C(=O)[O-])C[C@H]1O[C@@H](n2cnc3c(N)ncnc32)[C@H](O)[C@@H]1O,Ademetionine,Ademetionine; AdoMet; L-S-Adenosylmethionine; S-Adenosylmethionine; SAM; SAM-e; SAMe
CC(=O)C(=O)O,Pyruvic acid,2-ketopropionic acid; 2-oxopropanoic acid; 2-Oxopropansäure; 2-Oxopropionsäure; a-Ketopropionic acid; Acetylformic acid; acide pyruvique; alpha-ketopropionic acid; Brenztraubensäure; BTS; Pyroracemic acid; α-ketopropionic acid; α-Oxopropionsäure
N[C@@H](Cc1ccccc1)C(=O)O,Phenylalanine,(S)-2-Amino-3-phenylpropionic acid; (S)-alpha-Amino-beta-phenylpropionic acid; 3-phenyl-L-alanine; beta-Phenyl-L-alanine; F; Fenilalanina; L-Phenylalanine; Phe; Phenylalanine; Phenylalaninum; β-phenyl-L-alanine
O=C(O)CCCC[C@@H]1SC[C@@H]2NC(=O)N[C@H]12,Biotin,"(+)-cis-Hexahydro-2-oxo-1H-thieno[3,4]imidazole-4-valeric acid; (3aS,4S,6aR)-Hexahydro-2-oxo-1H-thieno[3,4-d]imidazole-4-valeric acid; 5-(2-oxohexahydro-1H-thieno[3,4-d]imidazol-4-yl)pentanoic acid; Biotin; Biotina; Biotine; Biotinum; cis-(+)-Tetrahydro-2-oxothieno[3,4]imidazoline-4-valeric acid; cis-Hexahydro-2-oxo-1H-thieno(3,4)imidazole-4-valeric acid; cis-Tetrahydro-2-oxothieno(3,4-d)imidazoline-4-valeric acid; Coenzyme R; D-(+)-biotin; D-Biotin; Vitamin B7; Vitamin H"
C[N+](C)(C)CCO,Choline,"Bilineurine; Choline ion; N-trimethylethanolamine; N,N,N-trimethylethanol-ammonium; trimethylethanolamine; Vitamin J"
NCCCC[C@H](N)C(=O)O,Lysine,"(S)-2,6-diaminohexanoic acid; (S)-lysine; (S)-α,ε-diaminocaproic acid; 6-ammonio-L-norleucine; L-2,6-Diaminocaproic acid; L-lys; L-Lysin; L-Lysine; LYS; Lysina; Lysine; Lysine acid; Lysinum"
O=C1O[C@H]([C@@H](O)CO)C(O)=C1O,Ascorbic acid,acide ascorbique; ácido ascórbico; Acidum ascorbicum; acidum ascorbinicum; Ascorbate; Ascorbic acid; Ascorbinsäure; L-(+)-ascorbic acid; L-Ascorbate; L-Ascorbic Acid; Vitamin C; Vitamina C
N[C@@H](CC(=O)O)C(=O)O,Aspartic acid,(S)-2-aminobutanedioic acid; (S)-2-aminosuccinic acid; 2-Aminosuccinic acid; ácido aspártico; Acidum asparticum; Asp; Aspartic acid; D; L-Asp; L-Asparaginsäure; L-Aspartate; L-Aspartic acid
NCCC[C@H](N)C(=O)O,Ornithine,"(S)-2,5-Diaminopentanoate; (S)-2,5-Diaminopentanoic acid; (S)-2,5-diaminovaleric acid; (S)-ornithine; (S)-α,δ-diaminovaleric acid; L-Ornithine; levo-ornithine; Ornithine; Ornithinum; Ornitina"
NC(=O)CC[C@H](N)C(=O)O,L-Glutamine,"(2S)-2-amino-4-carbamoylbutanoic acid; (2S)-2,5-diamino-5-oxopentanoic acid; (S)-2,5-diamino-5-oxopentanoic acid; Glutamic acid 5-amide; Glutamic acid amide; Glutamina; Glutamine; L-(+)-glutamine; L-2-aminoglutaramic acid; L-glutamic acid γ-amide; L-Glutamin; L-Glutamine; L-Glutaminsäure-5-amid; Levoglutamide; Q"
Nc1ncnc2c1ncn2[C@@H]1O[C@H](COP(=O)(O)O)[C@@H](O)[C@H]1O,Adenosine phosphate,5'-Adenosine monophosphate; 5'-Adenylic acid; 5'-AMP; 5'-O-Phosphonoadenosine; Adenosine 5'-(dihydrogen phosphate); Adenosine 5'-monophosphate; Adenosine 5'-phosphate; Adenosine monophosphate; Adenosine phosphate; Adenosine-5'-Monophosphate; Adenosine-5'-monophosphoric acid; Adenosine-5'P; Adenosini phosphas; Adenylate; Adenylic acid; Ado5'P; AMP; Fosfato de adenosina; PAdo; Phosphate d'adénosine
CC/C=C\C/C=C\C/C=C\CCCCCCCC(=O)O,alpha-Linolenic acid,"(9,12,15)-linolenic acid; (9Z,12Z,15Z)-Octadecatrienoic acid; (Z,Z,Z)-9,12,15-octadecatrienoic acid; 9-cis,12-cis,15-cis-octadecatrienoic acid; 9,12,15-Octadecatrienoic acid; ALA; all-cis-9,12,15-Octadecatrienoic acid; alpha-Linolenic acid; cis-delta(9,12,15)-Octadecatrienoic acid; cis,cis,cis-9,12,15-Octadecatrienoic acid; Linolenic acid; α-linolenic acid"
CSCC[C@H](N)C(=O)O,Methionine,(2S)-2-amino-4-(methylsulfanyl)butanoic acid; (S)-2-amino-4-(methylthio)butanoic acid; (S)-2-amino-4-(methylthio)butyric acid; (S)-methionine; L-(−)-methionine; L-a-Amino-g-methylthiobutyric acid; L-Methionin; L-Methionine; L-α-amino-γ-methylmercaptobutyric acid; M; Met; Methionine
N[C@@H](Cc1ccc(O)cc1)C(=O)O,Tyrosine,(−)-α-amino-p-hydroxyhydrocinnamic acid; (2S)-2-amino-3-(4-hydroxyphenyl)propanoic acid; (S)-(-)-Tyrosine; (S)-2-Amino-3-(p-hydroxyphenyl)propionic acid; (S)-3-(p-Hydroxyphenyl)alanine; (S)-alpha-amino-4-Hydroxybenzenepropanoic acid; (S)-Tyrosine; (S)-α-amino-4-hydroxybenzenepropanoic acid; 4-hydroxy-L-phenylalanine; L-Tyrosin; L-tyrosine; Tirosina; Tyr; Tyrosine; Tyrosinum; Y
C=C1/C(=C\C=C2/CCC[C@@]3(C)[C@H]2CC[C@@H]3[C@H](C)CCCC(C)(C)O)C[C@@H](O)C[C@@H]1O,Calcitriol,"(1S,3R,5Z,7E)-9,10-secocholesta-5,7,10-triene-1,3,25-triol; (1α,3β,5Z,7E)-9,10-secocholesta-5,7,10(19)-triene-1,3,25-triol; (5Z,7E)-(1S,3R)-9,10-secocholesta-5,7,10(19)-triene-1,3,25-triol; 1-alpha-25-Dihydroxyvitamin D3; 1,25-DHCC; 1,25-dihydroxycholecalciferol; 1α,25-dihydroxycholecalciferol; 1α,25-dihydroxyvitamin D3; 1α,25(OH)2D3; Calcitriol; Calcitriolum"
CC1=C[C@H](O)CC(C)(C)[C@H]1/C=C/C(C)=C/C=C/C(C)=C/C=C/C=C(C)/C=C/C=C(C)/C=C/C1=C(C)C[C@@H](O)CC1(C)C,Lutein,Xanthophyll; Xantofyl
N[C@@H](CSSC[C@H](N)C(=O)O)C(=O)O,Cystine,"(R,R)-3,3'-dithiobis(2-aminopropanoic acid); Cistina; Cystine; L-alpha-Diamino-beta-dithiolactic acid; L-Cystine; L-Dicysteine; β,β'-dithiodialanine"
O=C(O)CCC(=O)O,Succinic acid,"1,2-ethanedicarboxylic acid; Acide butanedioïque; Acide succinique; Acidum succinicum; Amber acid; Asuccin; Bernsteinsäure; Butandisäure; Butanedioic acid; Butanedionic acid; Dihydrofumaric acid; Ethylenesuccinic acid; Spirit of amber; Succinic acid"
Cc1cc2nc3c(=O)[nH]c(=O)nc-3n(C[C@H](O)[C@H](O)[C@H](O)CO)c2cc1C,Riboflavin,"1-Deoxy-1-(7,8-dimethyl-2,4-dioxo-3,4-dihydrobenzo[g]pteridin-10(2H)-yl)pentitol; 6,7-Dimethyl-9-D-ribitylisoalloxazine; 7,8-Dimethyl-10-(D-ribo-2,3,4,5-tetrahydroxypentyl)isoalloxazine; 7,8-Dimethyl-10-ribitylisoalloxazine; Lactoflavin; Lactoflavine; Riboflavin; Riboflavina; Riboflavine; Riboflavinum; Vitamin B2; Vitamin Bi; Vitamin G"
CC(=O)N[C@@H](C=O)[C@@H](O)[C@H](O)[C@H](O)CO,N-Acetylglucosamine,2-Acetamido-2-deoxy-D-glucose; aldehydo-N-acetyl-D-glucosamine; D-GlcNAc; N-Acetyl-D-glucosamine; N-Acetylchitosamine
N[C@@H](CCC(=O)O)C(=O)O,Glutamic acid,(2S)-2-Aminopentanedioic acid; (S)-2-Aminopentanedioic acid; (S)-Glutamic acid; ácido glutámico; Glu; Glutamic acid; L-Glutamate; L-Glutamic acid; L-Glutaminic acid
N[C@@H](CCC(=O)N[C@@H](CS)C(=O)NCC(=O)O)C(=O)O,Glutathione,"5-L-Glutamyl-L-cysteinylglycine; AEC GLUTATHIONE; gamma-L-Glutamyl-L-cysteinyl-glycine; Glutathion; Glutathione; Glutathione-SH; GLYCINE, L-.GAMMA.-GLUTAMYL-L-CYSTEINYL-; GSH; L-GLUTATHIONE REDUCED; Liposomal glutathione; N-(N-gamma-L-Glutamyl-L-cysteinyl)glycine; Reduced glutathione; REDUCED L-GLUTATHIONE"
NCC(=O)O,Glycine,Aminoacetic acid; Aminoessigsäure; Aminoethanoic acid; Glicina; Gly; Glycin; Glycine; Glycocoll; Glykokoll; Glyzin; Leimzucker
C=C1CC[C@H](O)C/C1=C/C=C1\CCC[C@@]2(C)[C@H]1CC[C@@H]2[C@H](C)CCCC(C)(C)O,Calcifediol,"(3S,5Z,7E)-9,10-secocholesta-5,7,10-triene-3,25-diol; (3β,5Z,7E)-9,10-secocholesta-5,7,10(19)-triene-3,25-diol; (5Z,7E)-(3S)-9,10-secocholesta-5,7,10(19)-triene-3,25-diol; 25-hydroxycholecalciferol; 25-Hydroxyvitamin D3; Calcidiol; Calcifédiol; Calcifediol; Calcifediol anhydrous; Calcifediolum"
CN(CC(=O)O)C(=N)N,Creatine,((amino(Imino)methyl)(methyl)amino)acetic acid; (alpha-Methylguanido)acetic acid; (N-methylcarbamimidamido)acetic acid; (α-methylguanido)acetic acid; alpha-Methylguanidino acetic acid; Creatin; Creatine; Kreatin; Methylglycocyamine; N-(aminoiminomethyl)-N-methylglycine; N-amidinosarcosine; N-carbamimidoyl-N-methylglycine; N-methyl-N-guanylglycine
N[C@@H](Cc1c[nH]c2ccccc12)C(=O)O,Tryptophan,(2S)-2-amino-3-(1H-indol-3-yl)propanoic acid; (S)-alpha-Amino-beta-(3-indolyl)-propionic acid; (S)-Tryptophan; (S)-α-amino-1H-indole-3-propanoic acid; L-(-)-Tryptophan; L-(−)-tryptophan; L-Tryptophan; L-β-3-indolylalanine; Triptofano; Trp; Tryptophan; Tryptophane; Tryptophanum; W
N[C@@H](CS)C(=O)O,Cysteine,(2R)-2-amino-3-mercaptopropanoic acid; (2R)-2-amino-3-sulfanylpropanoic acid; (R)-2-Amino-3-mercaptopropanoic acid; Cisteina; Cisteinum; Cys; Cysteine; Cysteinum; Free Cysteine; L-2-Amino-3-mercaptopropionic acid; L-Cys; L-Cystein; L-cysteine; L-Zystein
Cc1ncc(C[n+]2csc(CCO)c2C)c(N)n1,Thiamine,Aneurin; Antiberiberi factor; Thiamin; Thiamine; thiamine(1+); thiamine(1+) ion; thiaminium; Thiaminum; Tiamina; Vitamin B1
C=C1CC[C@H](O)C/C1=C/C=C1\CCC[C@@]2(C)[C@H]1CC[C@@H]2[C@H](C)/C=C/[C@H](C)C(C)C,Ergocalciferol,"(3β,5Z,7E,22E)-9,10-secoergosta-5,7,10(19),22-tetraen-3-ol; (5Z,7E,22E)-(3S)-9,10-seco-5,7,10(19),22-ergostatetraen-3-ol; (5Z,7E,22E)-(3S)-9,10-secoergosta-5,7,10(19),22-tetraen-3-ol; Activated ergosterol; Ercalciol; Ergocalciférol; Ergocalciferol; Ergocalciferolum; Oleovitamin D2; Viosterol; Vitamin D-2; Vitamin D2; Vitamina D2"
C[C@@H](O)[C@H](N)C(=O)O,Threonine,"(2S,3R)-(-)-Threonine; (2S)-threonine; 2-Amino-3-hydroxybutyric acid; L-(-)-Threonine; L-2-Amino-3-hydroxybutyric acid; L-alpha-amino-beta-hydroxybutyric acid; L-Threonin; L-Threonine; L-α-amino-β-hydroxybutyric acid; Thr; Threonine; Threoninum; Treonina"
NC(=O)C1=CN([C@@H]2O[C@H](CO[P@@](=O)(O)O[P@@](=O)(O)OC[C@H]3O[C@@H](n4cnc5c(N)ncnc54)[C@H](O)[C@@H]3O)[C@@H](O)[C@H]2O)C=CC1,NADH,"1,4-dihydronicotinamide adenine dinucleotide; DPNH; NAD reduced form; Nicotinamide adenine dinucleotide (reduced); Nicotinamide-adenine dinucleotide, reduced; Reduced nicotinamide adenine diphosphate; Reduced nicotinamide-adenine dinucleotide"
Nc1nc(=O)c2nc(CNc3ccc(C(=O)N[C@@H](CCC(=O)O)C(=O)O)cc3)cnc2[nH]1,Folic acid,"Acide folique; ácido fólico; Acidum folicum; Folacin; Folate; Folic acid; Folsäure; N-[(4-{[(2-amino-4-oxo-1,4-dihydropteridin-6-yl)methyl]amino}phenyl)carbonyl]-L-glutamic acid; N-pteroyl-L-glutamic acid; PGA; PteGlu; Pteroyl-L-glutamate; Pteroyl-L-glutamic acid; Pteroyl-L-monoglutamic acid; Pteroylglutamic acid; Vitamin B9; Vitamin Bc; Vitamin M"
CC/C=C\C/C=C\C/C=C\C/C=C\C/C=C\CCCC(=O)O,Icosapent,"(5Z,8Z,11Z,14Z,17Z)-5,8,11,14,17-eicosapentaenoic acid; (5Z,8Z,11Z,14Z,17Z)-Eicosapentaenoate; (5Z,8Z,11Z,14Z,17Z)-Eicosapentaenoic acid; (5Z,8Z,11Z,14Z,17Z)-Icosapentaenoic acid; (all-Z)-5,8,11,14,17-eicosapentaenoic acid; 5,8,11,14,17-eicosapentaenoic acid; 5,8,11,14,17-Icosapentaenoic acid; all-cis-5,8,11,14,17-eicosapentaenoic acid; all-cis-5,8,11,14,17-icosapentaenoic acid; all-cis-icosa-5,8,11,14,17-pentaenoic acid; cis-5,8,11,14,17-eicosapentaenoic acid; cis-5,8,11,14,17-EPA; cis-delta(5,8,11,14,17)-Eicosapentaenoic acid; Eicosapentaenoic acid; EPA; Icosapent; Icosapentaenoic acid; Icosapento; Icosapentum; Timnodonic acid"
CC(C)[C@H](N)C(=O)O,Valine,(2S)-2-Amino-3-methylbutanoic acid; (S)-Valine; 2-Amino-3-methylbutyric acid; L-(+)-alpha-Aminoisovaleric acid; L-alpha-Amino-beta-methylbutyric acid; L-valin; L-valine; Val; Valine
CC1=C(/C=C/C(C)=C/C=C/C(C)=C/CO)C(C)(C)CCC1,Vitamin A,"(2E,4E,6E,8E)-3,7-dimethyl-9-(2,6,6-trimethylcyclohex-1-en-1-yl)nona-2,4,6,8-tetraen-1-ol; all-trans-retinol; all-trans-retinyl alcohol; all-trans-vitamin A alcohol; Retinol; Retinolum; Vitamin A1"
Cc1c(C)c2c(c(C)c1O)CC[C@@](C)(CCC[C@H](C)CCC[C@H](C)CCCC(C)C)O2,Vitamin E,"(+)-α-tocopherol; (2R,4'R,8'R)-α-tocopherol; (R,R,R)-α-tocopherol; 5,7,8-trimethyltocol; alpha-tocopherol; d-α-tocopherol"
Cc1ncc(CO)c(CO)c1O,Pyridoxine,"2-methyl-3-hydroxy-4,5-dihydroxymethylpyridine; 3-hydroxy-4,5-bis(hydroxymethyl)-2-methylpyridine; 3-hydroxy-4,5-dimethylol-α-picoline; 5-hydroxy-6-methyl-3,4-pyridinedimethanol; Piridoxina; Pyridoxine; Pyridoxinum; Pyridoxol; Vitamin B6"
O=C(O)CCCC[C@@H]1CCSS1,Lipoic acid,"(+)-alpha-Lipoic acid; (R)-(+)-Lipoate; (R)-(+)-lipoic acid; (R)-1,2-Dithiolane-3-pentanoic acid; (R)-1,2-dithiolane-3-valeric acid; (R)-6,8-thioctic acid; (R)-lipoic acid; Alpha lipoic acid; alpha-Lipoic acid; alpha-Liponsäure; D-thioctic acid; Lipoic acid; R-(+)-thioctic acid; R-alpha-lipoic acid; Thioctic acid; Thioctic acid D-form; α-lipoic acid"
C=C1CC[C@H](O)C/C1=C/C=C1\CCC[C@@]2(C)[C@H]1CC[C@@H]2[C@H](C)CCCC(C)C,Cholecalciferol,"(+)-vitamin D3; (3β,5Z,7E)-9,10-secocholesta-5,7,10(19)-trien-3-ol; (5Z,7E)-(3S)-9,10-secocholesta-5,7,10(19)-trien-3-ol; Activated 7-dehydrocholesterol; Calciol; CC; Cholecalciferol; Cholecalciferolum; Colecalciferol; Colecalciferolum; Oleovitamin D3; Vitamin D-3; Vitamin D3"
CC1=CC(=O)c2ccccc2C1=O,Menadione,"2-Methyl-1,4-Naphthalenedione; 2-Methyl-1,4-naphthochinon; 2-Methyl-1,4-naphthoquinone; Menadione; Vitamin K 3; Vitamin K3"
Nc1ncnc2nc[nH]c12,Adenine,6-Aminopurine; Adenin; Adenine; Vitamin B4
NC(=O)C[C@H](N)C(=O)O,Asparagine,"(2S)-2-amino-3-carbamoylpropanoic acid; (2S)-2,4-diamino-4-oxobutanoic acid; (S)-2-amino-3-carbamoylpropanoic acid; (S)-Asparagine; 2-Aminosuccinamic acid; alpha-aminosuccinamic acid; Asn; Asparagine; Aspartamic acid; L-2-aminosuccinamic acid; L-Asparagine; L-aspartic acid beta-amide; L-aspartic acid β-amide; α-aminosuccinamic acid"
CC[C@H](C)C(=O)O[C@H]1C[C@H](O)C=C2C=C[C@H](C)[C@H](CC[C@@H](O)C[C@@H](O)CC(=O)O)[C@H]21,Pravastatin,"(+)-(3R,5R)-3,5-dihydroxy-7-[(1S,2S,6S,8S,8aR)-6-hydroxy-2-methyl-8-{[(S)-2-methylbutyryl]oxy}-1,2,6,7,8,8a-hexahydro-1-naphthyl]heptanoic acid; Pravastatin; Pravastatin acid; Pravastatina; Pravastatine; Pravastatinum"
COCCCC/C(=N\OCCN)c1ccc(C(F)(F)F)cc1,Fluvoxamine,Fluvoxamina; Fluvoxamine; Fluvoxaminum
CCCCC(=O)N(Cc1ccc(-c2ccccc2-c2nn[nH]n2)cc1)[C@H](C(=O)O)C(C)C,Valsartan,(S)-N-Valeryl-N-{[2'-(1H-tetrazol-5-yl)biphenyl-4-yl]-methyl}-valine; N-(P-(O-1H-Tetrazol-5-ylphenyl)benzyl)-N-valeryl-L-valine; N-pentanoyl-N-{[2'-(1H-tetrazol-5-yl)biphenyl-4-yl]methyl}-L-valine; Valsartan
CCOC(=O)[C@H](CCc1ccccc1)N[C@@H](C)C(=O)N1[C@H](C(=O)O)C[C@@H]2CCC[C@@H]21,Ramipril,"(2S-(1(R*(R*)),2alpha,3abeta,6abeta))-1-(2-((1-(Ethoxycarbonyl)-3-phenylpropyl)amino)-1-oxopropyl)octahydrocyclopenta(b)pyrrole-2-carboxylic acid; Ramipril; Ramiprilum"
C[C@@H](Cc1ccc(O)c(O)c1)[C@H](C)Cc1ccc(O)c(O)c1,Masoprocol,"erythro-nordihydroguaiaretic acid; Masoprocol; Masoprocolum; meso-1,4-bis(3,4-dihydroxyphenyl)-2,3-dimethylbutane; meso-2,3-bis(3,4-dihydroxyphenylmethyl)butane; meso-4-[4-(3,4-dihydroxyphenyl)-2,3-dimethylbutyl]benzene-1,2-diol; meso-4,4'-(2,3-dimethyl-1,4-butanediyl)bis(pyrocatechol); meso-4,4'-(2,3-dimethyltetramethylene)dipyrocatechol; meso-NDGA; meso-nordihydroguaiaretic acid; meso-β,γ-dimethyl-α,δ-bis(3,4-dihydroxyphenyl)butan; Nordihydroguaiaretic acid"
CC1(C)O[C@@H]2C[C@H]3[C@@H]4C[C@H](F)C5=CC(=O)C=C[C@]5(C)[C@H]4[C@@H](O)C[C@]3(C)[C@]2(C(=O)CO)O1,Flunisolide,Flunisolida; Flunisolide; Flunisolide anhydrous; Flunisolidum
NCC(CC(=O)O)c1ccc(Cl)cc1,Baclofen,(+-)-Baclofen; 4-Amino-3-(4-chlorophenyl)butyric acid; Baclofen; Baclofène; Baclofeno; Baclofenum; beta-(4-Chlorophenyl)gaba; beta-(Aminomethyl)-4-chlorobenzenepropanoic acid; beta-(Aminomethyl)-p-chlorohydrocinnamic acid; beta-(p-Chlorophenyl)-gamma-aminobutyric acid; DL-4-Amino-3-p-chlorophenylbutanoic acid; DL-Baclofen; gamma-Amino-beta-(p-chlorophenyl)butyric acid
CC(N)Cc1ccccc1,Amphetamine,(+-)-alpha-Methylphenylethylamine; 1-phenyl-2-aminopropane; alpha-Methylbenzeneethaneamine; Amfetamina; Amfetamine; Amfetaminum; Amphetamine; beta-Aminopropylbenzene; beta-Phenylisopropylamin; Desoxynorephedrine; rac-(2R)-1-phenylpropan-2-amine; rac-amphetamine; α-methylbenzeneethaneamine; α-methylphenethylamine; β-aminopropylbenzene; β-phenylisopropylamine
CSCC[C@H](NC(=O)[C@H](Cc1c[nH]c2ccccc12)NC(=O)CCNC(=O)OC(C)(C)C)C(=O)N[C@@H](CC(=O)O)C(=O)N[C@@H](Cc1ccccc1)C(N)=O,Pentagastrin,Pentagastrin
CN1CCC[C@H]1c1cccnc1,Nicotine,(−)-nicotine; (S)-(−)-nicotine; (S)-3-(1-methylpyrrolidin-2-yl)pyridine; (S)-3-(N-methylpyrrolidin-2-yl)pyridine; (S)-Nicotine; 3-(2-(N-methylpyrrolidinyl))pyridine; 3-(N-methylpyrollidino)pyridine; L(−)-nicotine; Nicotina; Nicotine; Nicotine betadex; Nicotine polacrilex; Nikotin; Nikotyna
CC1O[C@@]2(CS1)CN1CCC2CC1,Cevimeline,"2-Methyspiro(1,3-oxathiolane-5,3)quinuclidine; Cevimelina; Cévimèline; Cevimeline; Cevimelinum"
O=C1Nc2ccc(Cl)cc2C(c2ccccc2Cl)=NC1O,Lorazepam,Loracepam; Lorazepam; o-Chlorooxazepam; o-Chloroxazepam
COC(=O)CCc1ccc(OCC(O)CNC(C)C)cc1,Esmolol,(±)-esmolol; (±)-methyl p-(2-hydroxy-3-(isopropylamino)propoxy)hydrocinnamate; 3-[4-(2-Hydroxy-3-isopropylamino-propoxy)-phenyl]-propionic acid methyl ester; Esmolol; Methyl 4-(2-hydroxy-3-((1-methylethyl)amino)propoxy)benzenepropanoate; methyl p-(2-hydroxy-3-(isopropylamino)propoxy)hydrocinnamate
CC(C)C[C@H](NC(=O)[C@H](Cc1ccccc1)NC(=O)c1cnccn1)B(O)O,Bortezomib,[(1R)-3-methyl-1-({(2S)-3-phenyl-2-[(pyrazin-2-ylcarbonyl)amino]propanoyl}amino)butyl]boronic acid; Bortezomib; N-[(1R)-1-(DIHYDROXYBORYL)-3-methylbutyl]-N-(pyrazin-2-ylcarbonyl)-L-phenylalaninamide
C#CC(O)(/C=C/Cl)CC,Ethchlorvynol,1-chloro-3-ethyl-1-penten-4-yn-3-ol; 1-Chloro-3-ethyl-pent-1-en-4-yn-3-ol; 3-(beta-chlorovinyl)-1-pentyn-3-ol; 3-(β-chlorovinyl)-1-pentyn-3-ol; etclorvinol; Ethchlorvynol; ethyl β-chlorovinyl ethynyl carbinol; β-chlorovinyl ethyl ethynyl carbinol
C[C@@](Cc1ccc(O)c(O)c1)(NN)C(=O)O,Carbidopa,"(-)-L-alpha-Hydrazino-3,4-dihydroxy-alpha-methylhydrocinnamic acid monohydrate; (S)-(−)-carbidopa; (S)-carbidopa; (αS)-α-hydrazino-3,4-dihydroxy-α-methylbenzenepropanoic acid; Carbidopa; Carbidopa (anhydrous); Carbidopa anhydrous; Carbidopum; L-3-(3,4-dihydroxyphenyl)-2-methyl-2-hydrazinopropionic acid; L-α-methyldopahydrazine"
CC(C)(N)Cc1ccccc1,Phentermine,"alpha,alpha-Dimethylphenethylamine; Fentermina; Phentermine; Phentermine resin; Phenterminum"
CC(C)NCCCC1(C(N)=O)c2ccccc2-c2ccccc21,Indecainide,Indecainida; Indecainide; Indecainidum
COc1cccc(C2(O)CCCCC2CN(C)C)c1,Tramadol,Tramadol; Tramadolum
Nc1ncnc2c1ncn2[C@@H]1O[C@H](CO)[C@@H](O)[C@@H]1O,Vidarabine,9-beta-D-arabinofuranosyl-9H-purin-6-amine; 9-beta-D-arabinofuranosyl-adenine; 9-beta-D-Arabinofuranosyladenine; 9-β-D-arabinofuranosyl-9H-purin-6-amine; 9-β-D-arabinofuranosyladenine; Spongoadenosine; Vidarabine; Vidarabinum
CC(C)NCC(O)COc1ccc(CCOCC2CC2)cc1,Betaxolol,1-(4-(2-(cyclopropylmethoxy)ethyl)phenoxy)-3-((1-methylethyl)amino)-2-propanol; 1-(isopropylamino)-3-[p-(cyclopropylmethoxyethyl)phenoxy]-2-propanol; Betaxolol; Bétaxolol; Betaxololum
OC(Cn1cncn1)(Cn1cncn1)c1ccc(F)cc1F,Fluconazole,Diflucan; Difluconazole; Fluconazol; Fluconazole; Fluconazolum; Triflucan
Cc1c(C)c2c(c(C)c1O)CCC(C)(COc1ccc(CC3SC(=O)NC3=O)cc1)O2,Troglitazone,Troglitazona; Troglitazone
CCOC(=O)C1=C[C@@H](OC(CC)CC)[C@H](NC(C)=O)[C@@H](N)C1,Oseltamivir,"(−)-oseltamivir; 1-Cyclohexene-1-carboxylic acid, 4-(acetylamino)-5-amino-3-(1-ethylpropoxy)-, ethyl ester, (3R-(3alpha,4beta,5alpha))-; Ethyl (3R,4R,5S)-4-acetamido-5-amino-3-(1-ethylpropoxy)-1-cyclohexene-1-carboxylate; Oseltamivir; Oséltamivir; Oseltamivirum"
CC[C@H]1OC(=O)[C@H](C)[C@@H](O[C@H]2C[C@@](C)(OC)[C@@H](O)[C@H](C)O2)[C@H](C)[C@@H](O[C@@H]2O[C@H](C)C[C@H](N(C)C)[C@H]2O)[C@](C)(O)C[C@@H](C)C(=O)[C@H](C)[C@@H](O)[C@]1(C)O,Erythromycin,3''-O-demethylerythromycin; Abomacetin; Eritromicina; Erythromycin; Erythromycin A; Erythromycin C; érythromycine; Erythromycinum
CC1=C2[N+]3=C(C=C4[N+]5=C(C(C)=C6N7[C@@H]8[C@H](CC(N)=O)[C@@]6(C)CCC(=O)NC[C@@H](C)OP(=O)([O-])O[C@@H]6[C@@H](CO)O[C@@H]([C@@H]6O)n6c[n+](c9cc(C)c(C)cc96)[Co-3]753(O)[N+]3=C1[C@@H](CCC(N)=O)[C@](C)(CC(N)=O)[C@]83C)[C@@H](CCC(N)=O)C4(C)C)[C@@H](CCC(N)=O)[C@]2(C)CC(N)=O,Hydroxocobalamin,Hydroxocobalamin; Hydroxocobalamin anhydrous; Hydroxocobalamine; Hydroxocobalaminum anhydrous; Hydroxycobalamin; OH-Cbl; Vitamin B-12b
Cn1c(=O)c2c(ncn2C)n(C)c1=O,Caffeine,"1-methyltheobromine; 1,3,7-trimethyl-2,6-dioxopurine; 1,3,7-trimethylpurine-2,6-dione; 1,3,7-trimethylxanthine; 3,7-Dihydro-1,3,7-trimethyl-1H-purin-2,6-dion; 7-methyltheophylline; Anhydrous caffeine; Cafeína; Caféine; Caffeine; Caffeinum; Coffein; Coffeinum; Guaranine; Koffein; Mateína; Methyltheobromine; Teína; Thein; Theine"
C[N+](C)(C)CCOC(=O)CCC(=O)OCC[N+](C)(C)C,Succinylcholine,"2,2'-[(1,4-dioxobutane-1,4-diyl)bis(oxy)]bis(N,N,N-trimethylethanaminium); Dicholine succinate; Succinocholine; Succinoylcholine; Succinylbischoline; Succinyldicholine; Suxamethonium"
CCCc1nn(C)c2c(=O)[nH]c(-c3cc(S(=O)(=O)N4CCN(C)CC4)ccc3OCC)nc12,Sildenafil,"1-((3-(4,7-Dihydro-1-methyl-7-oxo-3-propyl-1H-pyrazolo(4,3-d)pyrimidin-5-yl)-4-ethoxyphenyl)sulfonyl)-4-methylpiperazine; Sildenafil; Sildenafilo"
CN(CCOc1ccc(NS(C)(=O)=O)cc1)CCc1ccc(NS(C)(=O)=O)cc1,Dofetilide,beta-((p-Methanesulfonamidophenethyl)methylamino)methanesulfono-p-phenetidide; Dofetilida; Dofetilide; Dofetilidum
CCc1nc(N)nc(N)c1-c1ccc(Cl)cc1,Pyrimethamine,"2,4-Diamino-5-(4-chlorophenyl)-6-ethylpyrimidine; 2,4-Diamino-5-(P-chlorophenyl)-6-ethylpyrimidine; 2,4-Diamino-5-chlorophenyl-6-ethylpyrimidine; 5-(4-Chlorophenyl)-6-ethyl-2,4-diaminopyrimidine; 5-(4-Chlorophenyl)-6-ethyl-2,4-pyrimidinediamine; 5-(4'-Chlorophenyl)-2,4-diamino-6-ethylpyrimidine; CD; Chloridine; Chloridyn; Diaminopyritamin; Ethylpyrimidine; Pirimetamina; Primethamine; Pyriméthamine; Pyrimethamine; Pyrimethaminum"
COC(=O)[C@H]1[C@H]2C[C@@H]3c4[nH]c5cc(OC)ccc5c4CCN3C[C@H]2C[C@@H](OC(=O)c2cc(OC)c(OC)c(OC)c2)[C@@H]1OC,Reserpine,"(−)-reserpine; (3beta,16beta,17alpha,18beta,20alpha)-11,17-Dimethoxy-18-[(3,4,5-trimethoxybenzoyl)oxy]yohimban-16-carboxylic acid methyl ester; 3,4,5-trimethoxybenzoyl methyl reserpate; Reserpin; Reserpine"
CC[C@H]1OC(=O)[C@H](C)[C@@H](O[C@H]2C[C@@](C)(OC)[C@@H](O)[C@H](C)O2)[C@H](C)[C@@H](O[C@@H]2O[C@H](C)C[C@H](N(C)C)[C@H]2O)[C@](C)(O)C[C@@H](C)CN(C)[C@H](C)[C@@H](O)[C@]1(C)O,Azithromycin,Azithromycin; Azithromycine; Azithromycinum; Azitromicina
Clc1ccccc1CN1CCc2sccc2C1,Ticlopidine,Ticlopidina; Ticlopidine; Ticlopidinum
O=C(O[C@@H]1C[C@@H]2CC[C@H](C1)[N+]21CCCC1)C(O)(c1ccccc1)c1ccccc1,Trospium,
COc1ccc(-c2ccc3cc(C(=O)O)ccc3c2)cc1C12CC3CC(CC(C3)C1)C2,Adapalene,6-(3-(1-Adamantyl)-4-methoxyphenyl)-2-naphthoic acid; Adapalene; Adapalène; Adapaleno; Adapalenum
COc1ccc(OC)c(C(O)CNC(=O)CN)c1,Midodrine,"(±)-2-amino-N-(β-hydroxy-2,5-dimethoxyphenethyl)acetamide; 1-(2',5'-Dimethoxyphenyl)-2-glycinamidoethanol; 2-Amino-N-(2,5-dimethoxy-beta-hydroxyphenethyl)acetamide; DL-N1-(beta-Hydroxy-2,5-dimethoxyphenethyl)glycinamid; Midodrin; Midodrina; Midodrine; Midodrinum"
COc1ccnc(CS(=O)c2nc3ccc(OC(F)F)cc3[nH]2)c1OC,Pantoprazole,Pantoprazol; Pantoprazole; Pantoprazolum
Cc1cccc(Nc2ccncc2S(=O)(=O)NC(=O)NC(C)C)c1,Torasemide,1-Isopropyl-3-((4-m-toluidino-3-pyridyl)sulfonyl)urea; N-(((1-Methylethyl)amino)carbonyl)-4-((3-methylphenyl)amino)-3-pyridinesulfonamide; Torasemida; Torasemide; Torasémide; Torasemidum; Torsemide
CN(C)CCCC1(c2ccc(F)cc2)OCc2cc(C#N)ccc21,Citalopram,Citalopram; Citalopramum; Nitalapram
CN1CCC[C@@H]1Cc1c[nH]c2ccc(CCS(=O)(=O)c3ccccc3)cc12,Eletriptan,élétriptan; Eletriptán; Eletriptan; Eletriptanum
