SMILES,GENERIC_NAME,SYNONYMS
COC(=O)[C@@H]1CC2=CC(=O)CC[C@]2(C)[C@@]23O[C@@H]2C[C@@]2(C)[C@@H](CC[C@@]24CCC(=O)O4)[C@H]13,Eplerenone,Eplerenona; Eplerenone; Epoxymexrenone
CC(C)CN(C[C@@H](O)[C@H](Cc1ccccc1)NC(=O)O[C@H]1CCOC1)S(=O)(=O)c1ccc(N)cc1,Amprenavir,"(3S)-Tetrahydro-3-furanyl ((1S,2R)-3-(((4-aminophenyl)sulfonyl)(2-methylpropyl)amino)-2-hydroxy-1-(phenylmethyl)propyl)carbamate; Amprenavir; Amprénavir; Amprenavirum"
CC(=O)/N=c1/sc(S(N)(=O)=O)nn1C,Methazolamide,Metazolamida; Methazolamid; Méthazolamide; Methazolamide; Methazolamidum; Methenamide; Neptazaneat
O=C1CC[C@@]2(O)[C@H]3Cc4ccc(O)c5c4[C@@]2(CCN3CC2CC2)[C@H]1O5,Naltrexone,"17-(Cyclopropylmethyl)-4,5-epoxy-3,14-dihydroxymorphinan-6-one; 17-(Cyclopropylmethyl)-4,5α-epoxy-3,14-dihydroxymorphinan-6-one; N-Cyclopropylmethyl-14-hydroxydihydromorphinone; N-Cyclopropylmethylnoroxymorphone; Naltrexon; Naltrexona; Naltrexone; Naltrexonum"
CC(C)Nc1cccnc1N1CCN(C(=O)c2cc3cc(NS(C)(=O)=O)ccc3[nH]2)CC1,Delavirdine,(N-[2-[4-[3-(1-methylethylamino)pyridin-2-yl]piperazin-1-yl]carbonyl-1H-indol-5-yl] methanesulfonamide); 1-(3-((1-methylethyl)amino)-2-pyridinyl)-4-((5-((methylsulfonyl)amino)-1H-indol-2-yl)carbonyl)piperazine; 2-(4-(5-methanesulfonamido-1H-indol-2-ylcarbonyl)-1-piperazinyl)-N-(1-methylethyl)-3-pyridinamine; Delavirdin; Delavirdina; Delavirdine; Delavirdinum; N-(2-(1-(3-(isopropylamino)pyridin-2-yl)piperazine-4-carbonyl)-1H-indol-5-yl)methanesulfonamide; N-{2-[4-(3-Isopropylamino-pyridin-2-yl)-piperazine-1-carbonyl]-1H-indol-5-yl}-methanesulfonamide
CCOc1ccccc1OCCN[C@H](C)Cc1ccc(OC)c(S(N)(=O)=O)c1,Tamsulosin,(−)-tamsulosin; (R)-(−)-tamsulosin; (R)-5-(2-((2-(2-ethoxyphenoxy)ethyl)amino)propyl)-2-methoxybenzenesulfonamide; Tamsulosin; Tamsulosina; Tamsulosine; Tamsulosinum
CCC(=O)N(c1ccccc1)C1(COC)CCN(CCc2cccs2)CC1,Sufentanil,N-(4-(Methoxymethyl)-1-(2-(2-thienyl)ethyl)-4-piperidinyl)-N-phenylpropanamide; N-(4-(Methoxymethyl)-1-(2-(2-thienyl)ethyl)-4-piperidyl)propionanilide; Sufentanil; Sufentanilo; Sufentanilum; Sufentanyl
Nc1ccn([C@@H]2CS[C@H](CO)O2)c(=O)n1,Lamivudine,"(-)-1-((2R,5S)-2-(Hydroxymethyl)-1,3-oxathiolan-5-yl)cytosine; (-)-2'-Deoxy-3'-thiacytidine; 2',3'-Dideoxy-3'-thiacytidine; 3'-Thia-2',3'-dideoxycytidine; 3TC; beta-L-2',3'-Dideoxy-3'-thiacytidine; beta-L-3'-Thia-2',3'-dideoxycytidine; Lamivudin; Lamivudina; Lamivudine; Lamivudinum"
CCCCCN(C)CCC(O)(P(=O)(O)O)P(=O)(O)O,Ibandronate,ácido ibandrónico; Ibandronic acid
CCN(CC)C(=O)N1CCN(C)CC1,Diethylcarbamazine,Diethylcarbamazin; Diéthylcarbamazine; Diethylcarbamazine; Diethylcarbamazinum; Dietilcarbamazina
CC(C(=O)O)c1ccc(-c2ccccc2)c(F)c1,Flurbiprofen,"(±)-2-fluoro-α-methyl-4-biphenylacetic acid; 2-(2-fluorobiphenyl-4-yl)propanoic acid; 2-fluoro-α-methyl-(1,1'-biphenyl)-4-acetic acid; 3-fluoro-4-phenylhydratropic acid; Flurbiprofen; Flurbiprofene; Flurbiprofeno; Flurbiprofenum"
Cc1onc(-c2ccccc2)c1C(=O)N[C@@H]1C(=O)N2[C@@H](C(=O)O)C(C)(C)S[C@H]12,Oxacillin,"(2S,5R,6R)-3,3-dimethyl-6-{[(5-methyl-3-phenylisoxazol-4-yl)carbonyl]amino}-7-oxo-4-thia-1-azabicyclo[3.2.0]heptane-2-carboxylic acid; (5-methyl-3-phenyl-4-isoxazolyl)penicillin; 5-methyl-3-phenyl-4-isoxazolyl-penicillin; 6β-(5-methyl-3-phenylisoxazol-4-yl)penicillanic acid; Ossacillina; Oxacilina; Oxacillin; Oxacilline; Oxacillinum; Oxazocillin; Oxazocilline"
CN1CCc2cccc3c2[C@H]1Cc1ccc(O)c(O)c1-3,Apomorphine,"(−)-10,11-dihydroxyaporphine; (6aR)-6-methyl-5,6,6a,7-tetrahydro-4H-dibenzo[de,g]quinoline-10,11-diol; (R)-5,6,6a,7-tetrahydro-6-methyl-4H-dibenzo[de,g]quinoline-10,11-diol; Apomorfina; Apomorphin; Apomorphine; R-(−)-apomorphine"
Fc1ccc([C@@H]2CCNC[C@H]2COc2ccc3c(c2)OCO3)cc1,Paroxetine,"(−)-(3S,4R)-4-(p-fluorophenyl)-3-((3,4-(methylenedioxy)phenoxy)methyl)piperidine; (3S-trans)-3-((1,3-benzodioxol-5-yloxy)methyl)-4-(4-fluorophenyl)piperidine; Paroxetina; Paroxetine; Paroxetinum"
CCCc1c2oc(C(=O)O)cc(=O)c2cc2c(=O)cc(C(=O)O)n(CC)c12,Nedocromil,"9-Ethyl-6,9-dihydro-4,6-dioxo-10-propyl-4H-pyrano(3,2-g)chinolin-2,8-dicarbonsäure; 9-ethyl-6,9-dihydro-4,6-dioxo-10-propyl-4H-pyrano(3,2-g)quinoline-2,8-dicarboxylic acid; Nedocromil; Nédocromil; Nedocromilo; Nedocromilum"
C#C[C@]1(O)CC[C@H]2[C@@H]3CCC4=CC(=O)CC[C@@H]4[C@H]3CC[C@@]21C,Norethisterone,"(17alpha)-17-ethynyl-17-hydroxyestra-4,8(14),9-trien-3-one; 17-hydroxy-19-nor-17-α-pregn-4-en-20-yn-3-one; 17-hydroxy-19-nor-17α-pregn-4-en-20-yn-3-one; 17-α-ethynyl-17-hydroxy-4-estren-3-one; 17-α-ethynyl-19-norandrost-4-en-17-β-ol-3-one; 17-α-ethynyl-19-nortestosterone; 17-α-ethynyl-4-estren-17-ol-3-one; 17-β-hydroxy-19-norpregn-4-en-20-yn-3-one; 17α-ethinyl-19-nortestosterone; 17α-ethinylestra-4-en-17β-ol-3-one; 17α-ethynyl-17-hydroxy-4-estren-3-one; 17α-ethynyl-17β-hydroxy-19-norandrost-4-en-3-one; 17α-ethynyl-19-nor-4-androsten-17β-ol-3-one; 17α-ethynyl-19-norandrost-4-en-17β-ol-3-one; 17α-ethynyl-19-nortestosterone; 17α-ethynyl-4-estren-17-ol-3-one; 17β-hydroxy-19-norpregn-4-en-20-yn-3-one; 19-nor-17-α-ethynyl-17-β-hydroxy-4-androsten-3-one; 19-nor-17-α-ethynylandrosten-17-β-ol-3-one; 19-nor-17-α-ethynyltestosterone; 19-Nor-17alpha-ethynyl-17beta-hydroxy-4-androsten-3-one; 19-nor-17α-ethynyl-17β-hydroxy-4-androsten-3-one; 19-nor-17α-ethynylandrosten-17β-ol-3-one; 19-nor-17α-ethynyltestosterone; 19-nor-ethindrone; 19-norethisterone; 4-estren-17α-ethynyl-17β-ol-3-one; Norethindrone; Norethisteron; Norethisterone; Noréthistérone; Norethisteronum; Noretisterona"
CC(C)(C)C(=O)OCOP(=O)(COCCn1cnc2c(N)ncnc21)OCOC(=O)C(C)(C)C,Adefovir dipivoxil,Adefovir di(pivaloyloxymethyl) ester; Adefovir dipivoxil; Adefovir pivoxil; bis-POM PMEA
CN1CCC(=C2c3ccccc3CCc3cccnc32)CC1,Azatadine,"11-(1-Methyl-4-piperidinylidene)-6,11-dihydro-5H-benzo[5,6]cyclohepta[1,2-b]pyridine; 6,11-Dihydro-11-(1-methyl-4-piperidylidene)-5H-benzo(5,6)cyclohepta(1,2-b)pyridine; Azatadin; Azatadina; Azatadine; Azatadinum"
O=P(O)(O)C(Cl)(Cl)P(=O)(O)O,Clodronic acid,"(Dichloro-phosphono-methyl)-phosphonic acid; (dichloromethylene)bisphosphonic acid; (dichloromethylene)diphosphonic acid; Acide clodronique; Acido clodronico; Acidum clodronicum; Clodronate; Clodronic acid; Clodronsaeure; Clodronsäure; dichloromethylene-1,1-bisphosphonic acid; dichloromethylene-1,1-diphosphonic acid; Dichloromethylidene diphosphonate; PHOSPHONIC ACID, (DICHLOROMETHYLENE)BIS-"
CCN(CC)CCOC(=O)c1ccc(N)cc1,Procaine,2-Diethylaminoethyl p-aminobenzoate; 4-aminobenzoic acid 2-diethylaminoethyl ester; Novocaine; p-Aminobenzoic acid 2-diethylaminoethyl ester; Procaina; Procaine; Procainum; Vitamin H3; β-(diethylamino)ethyl 4-aminobenzoate; β-(diethylamino)ethyl p-aminobenzoate
NCCCC[C@H](N[C@@H](CCc1ccccc1)C(=O)O)C(=O)N1CCC[C@H]1C(=O)O,Lisinopril,(S)-1-(N(2)-(1-Carboxy-3-phenylpropyl)-L-lysyl)-L-proline; [N2-[(S)-1-carboxy-3-phenylpropyl]-L-lysyl-L-proline; Lisinopril; Lisinopril anhydrous; Lisinoprilum
COc1ccc(OC)c(C(O)C(C)N)c1,Methoxamine,Méthoxamédrine; Methoxamin; Methoxamine; Méthoxamine; Methoxaminum; Metossamina; Metoxamina; Pseudomethoxamine
CC(C)Cn1cnc2c(N)nc3ccccc3c21,Imiquimod,"1-isobutyl-1H-imidazo[4,5-c]quinolin-4-amine; 4-Amino-1-isobutyl-1H-imidazo(4,5-c)quinoline; Imiquimod; Imiquimodum"
C[N+]1(C)C2CCC1CC(OC(=O)C(O)c1ccccc1)C2.[Br-],Homatropine methylbromide,"3-alpha-Hydroxy-8-methyl-1-alpha-H,5-alpha-H-tropanium bromide mandelate; 8-Methylhomatropinium bromide; Homatropine methylbromide; Homatropini methylbromidum; Méthylbromure d'homatropine; Methylhomatropine; Methylhomatropine bromide; Methylhomatropinum bromatum; Metilbromuro de homatropina; Omatropina metilbromuro; Tropinium methobromide mandelate"
CC(CN(C)C)CN1c2ccccc2CCc2ccccc21,Trimipramine,"10,11-dihydro-N,N,β-trimethyl-5H-dibenz[b,f]azepine-5-propanamine; 5-(γ-dimethylamino-β-methylpropyl)-10,11-dihydro-5H-dibenzo[b,f]azepine; 5-[3-(dimethylamino)-2-methylpropyl]-10,11-dihydro-5H-dibenz[b,f]azepine; beta-Methylimipramine; Trimeprimina; Trimeprimine; Trimeproprimine; Trimipramina; Trimipramine; Trimipraminum; β-methylimipramine"
O=[N+]([O-])OCC(CO[N+](=O)[O-])O[N+](=O)[O-],Nitroglycerin,"1,2,3-propanetrioltrinitrate; 1,2,3-propanetriyl nitrate; Glycerin trinitrate; Glycerol trinitrate; Glycerol, nitric acid triester; Glyceroli trinitratis; Glyceroltrinitrat; Glyceryl trinitrate; NG; Nitroglicerina; Nitroglycerin; Nitroglycerine; Nitroglycerol; Nitromed; Propane-1,2,3-triyl trinitrate; Trinitrine; Trinitroglycerin; Trinitroglycerol"
C=CC[N+]1([C@H]2C[C@H]3[C@@H]4CC[C@H]5C[C@H](O)[C@@H](N6CCOCC6)C[C@]5(C)[C@H]4CC[C@]3(C)[C@H]2OC(C)=O)CCCC1,Rocuronium,Rocuronio; Rocuronium
c1ccc2[nH]c(-c3cscn3)nc2c1,Thiabendazole,"2-(1,3-thiazole-4-yl)-1H-benzimidazole; 2-(4-thiazolyl)-1H-benzimidazole; 2-(thiazol-4-yl)benzimidazole; 4-(2-benzimidazolyl)thiazole; TBDZ; Thiabendazole; Tiabendazol; Tiabendazole; Tiabendazolum"
CC(C)[C@H]1CC[C@H](C(=O)N[C@H](Cc2ccccc2)C(=O)O)CC1,Nateglinide,Nateglinida; Natéglinide; Nateglinide; Nateglinidum
COc1ccc(CC2c3cc(OC)c(OC)cc3CC[N+]2(C)CCC(=O)OCCCCCOC(=O)CC[N+]2(C)CCc3cc(OC)c(OC)cc3C2Cc2ccc(OC)c(OC)c2)cc1OC.O=S(=O)([O-])c1ccccc1.O=S(=O)([O-])c1ccccc1,Atracurium besylate,Atracurium besilate; Atracurium besylate; Atracurium dibesylate; Besilate d'atracurium; Besilato de atracurio
C[n+]1ccccc1/C=N/O,Pralidoxime,2-PAM; Pralidoxim; Pralidoxima; Pralidoxime; Pralidoximum
Cc1nc2n(c(=O)c1CCN1CCC(c3noc4cc(F)ccc34)CC1)CCCC2,Risperidone,Risperidona; Rispéridone; Risperidone; Risperidonum
CN(CC=Cc1ccccc1)Cc1cccc2ccccc12,Naftifine,Naftifin; Naftifina; Naftifine; Naftifinum
COc1ccc2[nH]c([S@@](=O)Cc3ncc(C)c(OC)c3C)nc2c1,Esomeprazole,(−)-omeprazole; (S)-(−)-omeprazole; (S)-omeprazole; Esomeprazol; Ésoméprazole; Esomeprazole; Esomeprazolum; Omeprazole S-form; Perprazole
Cc1cccc(CN2CCN(C(c3ccccc3)c3ccc(Cl)cc3)CC2)c1,Meclizine,Meclizine; Meclozina; Meclozine
N=C(N)c1ccc(OCCCCCOc2ccc(C(=N)N)cc2)cc1,Pentamidine,"1,5-bis(4-amidinophenoxy)pentane; 4,4'-(1,5-pentanediylbis(oxy))bis-benzenecarboximidamide; 4,4'-(pentamethylenedioxy)dibenzamidine; 4,4'-Diamidinodiphenoxypentane; p,p'-(pentamethylenedioxy)dibenzamidine; Pentamidin; Pentamidina; Pentamidine; Pentamidinum"
CC1(C)S[C@@H]2[C@H](N3C(=O)[C@@H](c4ccccc4)NC3(C)C)C(=O)N2[C@H]1C(=O)O,Hetacillin,"(2S,5R,6R)-6-[(4R)-2,2-dimethyl-5-oxo-4-phenylimidazolidin-1-yl]-3,3-dimethyl-7-oxo-4-thia-1-azabicyclo[3.2.0]heptane-2-carboxylic acid; 6β-[(4R)-2,2-dimethyl-5-oxo-4-phenylimidazolidin-1-yl]penicillanic acid; Hetacilina; Hetacillin; Hétacilline; Hetacillinum"
Nc1nc2ccc(OC(F)(F)F)cc2s1,Riluzole,Riluzol; Riluzole; Riluzolum
C[C@]12C[C@H](O)[C@H]3[C@@H](CCC4=CC(=O)CC[C@@]43C)[C@@H]1CC[C@]2(O)C(=O)CO,Hydrocortisone,"(11β)-11,17,21-trihydroxypregn-4-ene-3,20-dione; 11beta-hydrocortisone; 11beta,17alpha,21-Trihydroxy-4-pregnene-3,20-dione; 11β-hydrocortisone; 17-Hydroxycorticosterone; 4-pregnen-11β,17α,21-triol-3,20-dione; Cortisol; Hidrocortisona; Hydrocortisone; Hydrocortisonum; Kendall's compound F; Reichstein's substance M"
OC[C@@H](O)[C@@H](O)[C@H](O)[C@H](O)CO,Mannitol,"(2R,3R,4R,5R)-hexane-1,2,3,4,5,6-hexaol; (2R,3R,4R,5R)-hexane-1,2,3,4,5,6-hexol; D-(-)-Mannitol; D-Mannitol; Manitol; Manna Sugar; Mannit; Mannite; Mannitol; Mannitolum"
O=C([O-])CN(CCN(CC(=O)[O-])CC(=O)[O-])CCN(CC(=O)O)C(COCc1ccccc1)C(=O)O.[Gd+3],Gadobenic acid,Acide gadobenique; Acido gadobenico; Acidum gadobenicum; Gadobenate; Gadobenic acid; Gadobensäure
CC(c1cc2ccccc2s1)N(O)C(N)=O,Zileuton,(±)-1-(1-Benzo[b]thien-2-ylethyl)-1-hydroxyurea; Leutrol; N-(1-Benzo(b)thien-2-ylethyl)-N-hydroxyurea; N-[1-(benzo[b]thiophen-2-yl)ethyl]-N-hydroxyurea; Zileuton; Zileutón; Zileutonum
NC(=O)CS(=O)C(c1ccccc1)c1ccccc1,Modafinil,2-((diphenylmethyl)sulfinyl)acetamide; Modafinil; Modafinilo; Modafinilum
CC(=O)N(O)CCCCCNC(=O)CCC(=O)N(O)CCCCCNC(=O)CCC(=O)N(O)CCCCCN,Deferoxamine,Deferoxamin; Deferoxamina; Deferoxamine; Déferoxamine; Deferoxaminum; Deferrioxamine; Deferrioxamine B; Desferrioxamine; DFO; DFOA; DFOM
CN1[C@H]2C[C@H](OC(=O)[C@H](CO)c3ccccc3)C[C@@H]1[C@H]1O[C@@H]21,Scopolamine,"(-)-hyoscine; (-)-scopolamine; (1S,3S,5R,6R,7S)-6,7-Epoxytropan-3-yl (2S)-3-hydroxy-2-phenylpropanoate; 6-beta,7-beta-Epoxy-3-alpha-tropanyl S-(-)-tropate; 6,7-Epoxytropine tropate; alpha-(Hydroxymethyl)benzeneacetic acid 9-methyl-3-oxa-9-azatricyclo(3.3.1.0(2.4))non-7-yl ester; Hyoscine; scopine (-)-tropate; scopine (−)-tropate; Scopolamine; Scopolamine hydrobromide"
CN(C)CCOC(c1ccc(Cl)cc1)c1ccccn1,Carbinoxamine,(±)-carbinoxamine; {2-[(4-Chloro-phenyl)-pyridin-2-yl-methoxy]-ethyl}-dimethyl-amine; 2-(p-chloro-α-(2-(dimethylamino)ethoxy)benzyl)pyridine; Carbinoxamin; Carbinoxamina; Carbinoxamine; Carbinoxamine base; Carbinoxaminum; Paracarbinoxamine
CCc1cccc2c3c([nH]c12)C(CC)(CC(=O)O)OCC3,Etodolac,"(±)-1,8-diethyl-1,3,4,9-tetrahydropyrano(3,4-b)indole-1-acetic acid; (1,8-Diethyl-1,3,4,9-tetrahydro-pyrano[3,4-b]indol-1-yl)-acetic acid; 1,3,4,9-tetrahydro-1,8-diethylpyrano(3,4-b)indole-1-acetic acid; 1,8-diethyl-1,3,4,9-tetrahydropyrano(3,4-b)indole-1-acetic acid; 1,8-diethyl-1,3,4,9-tetrahydropyrano[3,4-b]indol-1-ylacetic acid; Étodolac; Etodolac; Etodolaco; Etodolacum; Etodolic acid; Etodolsäure"
CCCNC(C)C(=O)Nc1ccccc1C,Prilocaine,2-(Propylamino)-o-propionotoluidide; 2-Methyl-alpha-propylaminopropionanilide; alpha-n-Propylamino-2-methylpropionanilide; N-(2-Methylphenyl)-2-(propylamino)propanamide; o-Methyl-2-propylaminopropionanilide; o-Methyl-alpha-propylaminopropionanilide; Prilocain; Prilocaina; Prilocaine; Prilocaïne; Prilocaine base; Prilocainum; Propitocaine
NC1=NCC2c3ccccc3Cc3ccccc3N12,Epinastine,"(±)-epinastine; 3-amino-9,13b-dihydro-1H-dibenz(c,f)imidazo(1,5-a)azepine; Epinastin; Epinastina; Epinastine; épinastine; Epinastinum"
NC1CC1c1ccccc1,Tranylcypromine,"(±)-trans-2-phenylcyclopropylamine; (1R*,2S*)-2-phenylcyclopropan-1-amine; dl-tranylcypromine; Racemic Tranylcypromine; Tranilcipromina; trans-2-phenylcyclopropylamine; trans-DL-2-Phenylcyclopropylamine; Transamine; Tranylcypromin; Tranylcypromine; Tranylcyprominum"
FC(F)OC(Cl)C(F)(F)F,Isoflurane,"1-chloro-2,2,2-trifluoroethyl difluoromethyl ether; Isoflurane; Isoflurano; Isofluranum"
CCN1C(=O)NC(c2ccccc2)C1=O,Ethotoin,"(±)-3-ethyl-5-phenylhydantoin; 1-ethyl-2,5-dioxo-4-phenylimidazolidine; 3-ethyl-5-phenyl-2,4-imidazolidinedione; 3-Ethyl-5-phenyl-imidazolidine-2,4-dione; 3-ethyl-5-phenylhydantoin; 3-ethyl-5-phenylimidazolidin-2,4-dione; Ethotoin; Ethotoïne; Ethotoinum; Etotoina"
CC1=C(/C=C/C(C)=C/C=C/C(C)=C/C(=O)O)C(C)(C)CCC1,Tretinoin,"(all-E)-3,7-Dimethyl-9-(2,6,6-trimethyl-1-cyclohexen-1-yl)-2,4,6,8-nonatetraenoic acid; 3,7-Dimethyl-9-(2,6,6-trimethyl-1-cyclohexene-1-yl)-2,4,6,8-nonatetraenoic acid (ECL); Acide retinoique; all trans Retinoic acid; all trans-Retinoic acid; all-(E)-Retinoic acid; all-trans-beta-Retinoic acid; all-trans-Retinoic acid; all-trans-Tretinoin; all-trans-Vitamin A acid; all-trans-Vitamin A1 acid; ATRA; beta-Retinoic acid; Retinoic acid; Retionic acid; trans-Retinoic acid; Tretin M; Tretinoin; Tretinoina; Trétinoïne; Tretinoinum; Vitamin A acid"
Oc1c(Cl)cc(Cl)c(Cl)c1Cc1c(O)c(Cl)cc(Cl)c1Cl,Hexachlorophene,"2,2'-dihydroxy-3,3',5,5',6,6'-hexachlorodiphenylmethane; 2,2'-dihydroxy-3,5,6,3',5',6'-hexachlorodiphenylmethane; 2,2'-methanediylbis(3,4,6-trichlorophenol); 2,2'-methylenebis(3,4,6-trichlorophenol); 2,2',3,3',5,5'-hexachloro-6,6'-dihydroxydiphenylmethane; bis(2-hydroxy-3,5,6-trichlorophenyl)methane; bis(3,5,6-trichloro-2-hydroxyphenyl)methane; hexachlorophène; Hexachlorophene; Hexachlorophenum; Hexaclorofeno"
O=C(O[C@@H]1C[C@@H]2C[C@H]3C[C@H](C1)N2CC3=O)c1c[nH]c2ccccc12,Dolasetron,Dolasétron; Dolasetron; Dolasetronum
COC(=O)[C@H](c1ccccc1Cl)N1CCc2sccc2C1,Clopidogrel,(+)-Clopidogrel; Clopidogrel; Clopidogrelum
CN(C)[C@@H]1C(O)=C(C(N)=O)C(=O)[C@@]2(O)C(O)=C3C(=O)c4c(O)cccc4[C@@](C)(O)[C@H]3C[C@@H]12,Tetracycline,"(4S,4aS,5aS,12aS)-4-(Dimethylamino)-1,4,4a,5,5a,6,11,12a-octahydro-3,6,10,12,12a-pentahydroxy-6-methyl-1,11-dioxo-2-naphthacenecarboxamide; Abramycin; Anhydrotetracycline; Deschlorobiomycin; Tetracyclin; Tétracycline; Tetracycline; Tetracyclinum; Tetrazyklin; Tsiklomitsin"
C[C@@H](O)[C@H]1C(=O)N2C(C(=O)O)=C(S[C@@H]3CN[C@H](C(=O)N(C)C)C3)[C@H](C)[C@H]12,Meropenem,"(4R,5S,6S)-3-{[(3S,5S)-5-(dimethylcarbamoyl)pyrrolidin-3-yl]thio}-6-[(1R)-1-hydroxyethyl]-4-methyl-7-oxo-1-azabicyclo[3.2.0]hept-2-ene-2-carboxylic acid; Meropenem; Meropenem anhydrous; Meropenemum"
[Cl-].[K+],Potassium chloride,Chlorid draselny; Chloride of potash; Kaliumchlorid; KCl; Monopotassium chloride; Muriate of potash; Potassium chloride; Sylvite
CCc1c2c(nc3ccc(OC(=O)N4CCC(N5CCCCC5)CC4)cc13)-c1cc3c(c(=O)n1C2)COC(=O)[C@]3(O)CC,Irinotecan,"(+)-Irinotecan; (S)-4,11-diethyl-4-hydroxy-3,14-dioxo-3,4,12,14-tetrahydro-1H-pyrano[3',4':6,7]indolizino[1,2-b]quinolin-9-yl 4-(2-(5-(3-(2,4-dihydroxy-5-isopropylphenyl)-5-hydroxy-4H-1,2,4-triazol-4-yl)-1H-indol-1-yl)ethyl)piperidine-1-carboxylate; Irinotecan; Irinotecan lactone; Irinotecan liposome injection; Irinotecanum"
Cn1cc[nH]c1=S,Methimazole,1-Methylimidazole-2(3H)-thione; Methimazole; Thiamazol; Thiamazole; Thiamazolum; Tiamazol
C[C@](N)(Cc1ccc(O)cc1)C(=O)O,Metyrosine,(-)-alpha-Methyl-L-tyrosine; (–)-α-methyl-L-tyrosine; (S)-alpha-Methyltyrosine; Methyltyrosine; Metirosin; Metirosina; Métirosine; Metirosine; Metirosinum; Metyrosine; α-methyl-L-p-tyrosine; α-methyl-p-tyrosine; α-methyl-para-tyrosine; α-MPT
O=C(O)[C@H]1/C(=C/CO)O[C@@H]2CC(=O)N21,Clavulanic acid,"(Z)-(2R,5R)-3-(2-Hydroxyethylidene)-7-oxo-4-oxa-1-azabicyclo(3.2.0)heptane-2-carboxylic acid; Acide clavulanique; ácido clavulánico; Acidum clavulanicum; Clavulanate; Clavulanic acid; Clavulansäure"
CN(C)CC/C=C1/c2ccccc2COc2ccc(CC(=O)O)cc21,Olopatadine,Olopatadin; Olopatadina; Olopatadine; Olopatadinum
CCN(CC)CC(=O)OCC(=O)[C@@]1(O)CC[C@H]2[C@@H]3CCC4=CC(=O)CC[C@]4(C)[C@H]3[C@@H](O)C[C@@]21C,Hydrocortamate,"17-Hydroxycorticosterone, 21-(diethylamino)acetate; Hidrocortamato; Hydrocortamate; Hydrocortamatum"
CCCCC[C@H](O)/C=C/[C@H]1[C@H](O)CC(=O)[C@@H]1CCCCCCC(=O)O,Alprostadil,"(11α,13E,15S)-11,15-dihydroxy-9-oxoprost-13-en-1-oic acid; (13E)-(15S)-11alpha,15-Dihydroxy-9-oxoprost-13-enoate; 11α,15α-dihydroxy-9-oxo-13-trans-prostenoic acid; Alprostadil; Alprostadilum; PGE-1; PGE1; Prostaglandin E1"
C[N@+]12CC[C@H](CC1)C(OC(=O)C(O)(c1ccccc1)c1ccccc1)C2,Clidinium,"3-(2-Hydroxy-2,2-diphenyl-acetoxy)-1-methyl-1-azonia-bicyclo[2.2.2]octane; 3-hydroxy-1-methylquinuclidinium benzilate ester; Bromure de Clidinium; Bromuro de clidinio; Clidinii Bromidum; Clidinium bromid; N-methyl quinuclidinyl benzilate"
CCOC(=O)CC(SP(=S)(OC)OC)C(=O)OCC,Malathion,"[(dimethoxyphosphinothioyl)thio]butanedioic acid diethyl ester; Carbophos; diethyl (dimethoxyphosphinothioylthio)succinate; Karbofos; Malathion; Maldison; Mercaptothion; O,O-dimethyl S-(1,2-bis(ethoxycarbonyl)ethyl); O,O-dimethyl S-(1,2-dicarbethoxyethyl) dithiophosphate; O,O-dimethyl S-(1,2-dicarbethoxyethyl)phosphorodithioate; O,O-dimethyl S-1,2-di(ethoxycarbamyl)ethyl; O,O-dimethyldithiophosphate diethylmercaptosuccinate"
COc1cc([C@@H]2c3cc4c(cc3[C@@H](O[C@@H]3O[C@@H]5CO[C@@H](C)O[C@H]5[C@H](O)[C@H]3O)[C@H]3COC(=O)[C@H]23)OCO4)cc(OC)c1O,Etoposide,"(−)-etoposide; 4-demethylepipodophyllotoxin β-D-ethylideneglucoside; 4'-Demethylepipodophyllotoxin 9-(4,6-O-(R)-ethylidene-beta-D-glucopyranoside); 9-((4,6-O-Ethylidine-beta-D-glucopyranosyl)oxy)-5,8,8a,9-tetrahydro-5-(4-hydroxy-3,4-dimethyloxyphenyl)furo(3',4'':6,7)naptho-(2,3-d)-1,3-dioxol-6(5aH)-one; Etoposide; Etoposido; Etoposidum; trans-Etoposide"
NS(=O)(=O)c1cc2c(cc1C(F)(F)F)NCNS2(=O)=O,Hydroflumethiazide,Dihydroflumethazide; Hidroflumetiazid; Hidroflumetiazida; Hydrofluméthiazide; Hydroflumethiazide; Hydroflumethiazidum; Idroflumetiazide; Metforylthiadiazin
CCCCS(=O)(=O)N[C@@H](Cc1ccc(OCCCCC2CCNCC2)cc1)C(=O)O,Tirofiban,(2S)-2-(butylsulfonylamino)-3-[4-(4-piperidin-4-ylbutoxy)phenyl]propanoic acid; N-(Butylsulfonyl)-O-(4-(4-piperidyl)butyl)-L-tyrosine; Tirofiban; Tirofibán; Tirofibanum
NC(=O)N1c2ccccc2CC(=O)c2ccccc21,Oxcarbazepine,"10,11-Dihydro-10-oxo-5H-dibenz(b,f)azepine-5-carboxamide; OCBZ; Oxcarbamazepine; Oxcarbazepina; Oxcarbazepine; Oxcarbazepinum"
CCC(=O)c1ccc2c(c1)N(CC(C)N(C)C)c1ccccc1S2,Propiomazine,10-(2-Dimethylaminopropyl)-2-propionylphenothiazine; 2-Propionyl-10-(2-(dimethylamino)propyl)phenothiazine; 3-Propionyl-10-dimethylaminoisopropylphenothiazine; Propiomazin; Propiomazina; Propiomazine; Propiomazinum
CC[C@H]1OC(=O)[C@H](C)[C@@H](O[C@H]2C[C@@](C)(OC)[C@@H](O)[C@H](C)O2)[C@H](C)[C@@H](O[C@@H]2O[C@H](C)C[C@H](N(C)C)[C@H]2O)[C@](C)(O)C[C@@H](C)C(=NOCOCCOC)[C@H](C)[C@@H](O)[C@]1(C)O,Roxithromycin,(9E)-erythromycin 9-(O-((2-methoxyethoxy)methyl)oxime); Roxithromycin; Roxithromycine; Roxithromycinum; Roxitromicina
CCn1cc(C(=O)O)c(=O)c2ccc(C)nc21,Nalidixic acid,"1-Aethyl-7-methyl-1,8-naphthyridin-4-on-3-karbonsaeure; 1-ethyl-1,4-dihydro-7-methyl-4-oxo-1,8-naphthyridine-3-carboxylic acid; 1-ethyl-7-methyl-1,4-dihydro-1,8-naphthyridin-4-one-3-carboxylic acid; 1-Ethyl-7-methyl-4-oxo-1,4-dihydro-[1,8]naphthyridine-3-carboxylic acid; 1,4-dihydro-1-ethyl-7-methyl-4-oxo-1,8-naphthyridine-3-carboxylic acid; 3-carboxy-1-ethyl-7-methyl-1,8-naphthyridin-4-one; Acide nalidixique; Acido nalidixico; Acidum nalidixicum; Nalidixic acid; Nalidixinsäure"
NNCCc1ccccc1,Phenelzine,Fenelzina; Phenelzin; Phénelzine; Phenelzine; Phenelzinum
CC(C)[N+](C)(CCOC(=O)C1c2ccccc2Oc2ccccc21)C(C)C,Propantheline,Propantheline
C[C@]12CC[C@@H]3c4ccc(O)cc4CC[C@H]3[C@@H]1CC[C@@H]2O,Estradiol,"(17β)-estra-1,3,5(10)-triene-3,17-diol; 17beta oestradiol; 17β-estra-1,3,5(10)-triene-3,17-diol; 17β-estradiol; 17β-oestradiol; beta-Estradiol; cis-Estradiol; Estradiol; Estradiol-17beta; Estradiolum"
Cc1cccc(Nc2ccccc2C(=O)O)c1C,Mefenamic acid,"Acide méfénamique; ácido mefenámico; Acidum mefenamicum; Mefenamic acid; Mefenaminsäure; N-(2,3-xylyl)-2-aminobenzoic acid; N-2,3-xylylanthranilic acid"
Nc1nc(=O)c2ncn(COCCO)c2[nH]1,Acyclovir,Aciclovir; Aciclovirum; Acycloguanosine; Acyclovir
COc1ccc2cc([C@H](C)C(=O)O)ccc2c1,Naproxen,(+)-(S)-6-Methoxy-α-methyl-2-naphthaleneacetic acid; (+)-(S)-Naproxen; (+)-2-(6-Methoxy-2-naphthyl)propionic acid; (+)-2-(Methoxy-2-naphthyl)-propionic acid; (+)-2-(Methoxy-2-naphthyl)-propionsäure; (+)-Naproxen; (S)-(+)-2-(6-Methoxy-2-naphthyl)propionic acid; (S)-(+)-Naproxen; (S)-2-(6-Methoxy-2-naphthyl)propanoic acid; (S)-2-(6-Methoxy-2-naphthyl)propionic acid; (S)-6-Methoxy-alpha-methyl-2-naphthaleneacetic acid; (S)-Naproxen; Naprolag; Naproxen; Naproxène; Naproxeno; Naproxenum
O=C([O-])CN(CCN(CC(=O)[O-])CC(=O)O)CCN(CC(=O)[O-])CC(=O)O.[Gd+3],Gadopentetic acid,Acide gadopentetique; ácido gadopentético; Acidum gadopenteticum; Gadolinium diethylenetriamine pentaacetic acid; Gadolinium DTPA; Gadopentetate; Gadopentetic acid
CCC[C@H](N[C@@H](C)C(=O)N1[C@H](C(=O)O)C[C@@H]2CCCC[C@@H]21)C(=O)OCC,Perindopril,"(2S,3aS,7aS)-1-[(2S)-2-{[(2S)-1-ethoxy-1-oxopentan-2-yl]amino}propanoyl]octahydro-1H-indole-2-carboxylic acid; Perindopril; Perindoprilum"
O=c1[nH]cc(N(CCCl)CCCl)c(=O)[nH]1,Uracil mustard,"5-(di-2-chloroethyl)aminouracil; 5-[bis(2-chloroethyl)amino]-2,4(1H,3H)-pyrimidinedione; 5-[bis(2-chloroethyl)amino]uracil; 5-[di(β-chloroethyl)amino]uracil; 5-aminouracil mustard; 5-N,N-bis(2-chloroethyl)aminouracil; Aminouracil mustard; Uracil mustard; Uracil nitrogen mustard; Uramustina; Uramustine; Uramustinum"
CN(C)CCN(Cc1ccccc1)c1ccccn1,Tripelennamine,Tripelennamin; Tripelennamina; Tripélennamine; Tripelennamine; Tripelennaminum
Clc1cc(Cl)c(OCC#CI)cc1Cl,Haloprogin,Haloprogin; Haloprogina; Haloprogine; Haloproginum
CCC1(c2ccccc2)C(=O)NCNC1=O,Primidone,"2-deoxyphenobarbital; 5-Phenyl-5-ethyl-Hexahydropyrimidine-4,6-dione; Primidon; Primidona; Primidone; Primidonum"
O=C(O)c1cc(/N=N/c2ccc(S(=O)(=O)Nc3ccccn3)cc2)ccc1O,Sulfasalazine,2-Hydroxy-5-((4-((2-pyridinylamino)sulfonyl)phenyl)azo)benzoic acid; 2-Hydroxy-5-[4-(pyridin-2-ylsulfamoyl)-phenylazo]-benzoic acid; 4-(Pyridyl-2-amidosulfonyl)-3'-carboxy-4'-hydroxyazobenzene; 5-((p-(2-Pyridylsulfamoyl)phenyl)azo)salicylic acid; 5-(4-(2-Pyridylsulfamoyl)phenylazo)-2-hydroxybenzoic acid; 5-(p-(2-Pyridylsulfamyl)phenylazo)salicylic acid; Azopyrin; Salazosulfapiridina; Salazosulfapyridine; Salazosulfapyridinum; Salicylazosulfapyridine; Sulfasalazin; Sulfasalazina; Sulfasalazine; Sulfasalazinum
CCOc1nc2cccc(C(=O)OC(C)OC(=O)OC3CCCCC3)c2n1Cc1ccc(-c2ccccc2-c2nnn[nH]2)cc1,Candesartan cilexetil,Candesartan cilexetil
c1ccc(CC2=NCCN2)cc1,Tolazoline,"2-Benzyl-2-imidazoline; 2-Benzyl-4,5-imidazoline; 2-Benzylimidazoline; 4,5-Dihydro-2-(phenylmethyl)-1H-imidazole; Benzazoline; Tolazolin; Tolazolina; Tolazoline; Tolazolinum"
CNC(C)[C@@H]1CC[C@@H](N)[C@@H](O[C@@H]2[C@@H](N)C[C@@H](N)[C@H](O[C@H]3OC[C@](C)(O)[C@H](NC)[C@H]3O)[C@H]2O)O1.CN[C@@H]1[C@@H](O)[C@@H](O[C@@H]2[C@@H](O)[C@H](O[C@H]3O[C@H](C(C)N)CC[C@H]3N)[C@@H](N)C[C@H]2N)OC[C@]1(C)O.CN[C@@H]1[C@@H](O)[C@@H](O[C@@H]2[C@@H](O)[C@H](O[C@H]3O[C@H](CN)CC[C@H]3N)[C@@H](N)C[C@H]2N)OC[C@]1(C)O,Gentamicin,Gentamicin; Gentamicina
CCOC(=O)c1ccc(C#Cc2ccc3c(c2)C(C)(C)CCS3)nc1,Tazarotene,Tazarotene; Tazarotène; Tazaroteno; Tazarotenum
Oc1ccc(C2CNCCc3c2cc(O)c(O)c3Cl)cc1,Fenoldopam,Fenoldopam; Fénoldopam; Fenoldopamum
O=C1CN=C(c2ccccc2)c2cc(Cl)ccc2N1CC(F)(F)F,Halazepam,Halazépam; Halazepam; Halazepamum
CCC(=O)N(c1ccccc1)C1(COC)CCN(CCn2nnn(CC)c2=O)CC1,Alfentanil,Alfentanil; Alfentanilo; Alfentanilum; Alfentanyl; N-(1-(2-(4-Ethyl-5-oxo-2-tetrazolin-1-yl)ethyl)-4-(methoxymethyl)-4-piperidyl)propionanilide
CCN(CC)CCOC(=O)C1(C2CCCCC2)CCCCC1,Dicyclomine,2-(diethylamino)ethyl 1-cyclohexylcyclohexanecarboxylate; Bicyclohexyl-1-carboxylic acid 2-diethylamino-ethyl ester; Dicicloverina; Dicyclomine; Dicycloverin; Dicycloverine; Dicycloverinum
Cc1cc(-c2ccccc2)nnc1NCCN1CCOCC1,Minaprine,4-(2-((4-Methyl-6-phenyl-3-pyridazinyl)amino)ethyl)morpholine; 4-Methyl-3-(2-morpholinoethylamino)-6-phenylpyridazin; Minaprina; Minaprine; Minaprinum; N-(4-Methyl-6-phenyl-3-pyridazinyl)-4-morpholineethanamine
CC(=O)CCCCn1c(=O)c2c(ncn2C)n(C)c1=O,Pentoxifylline,Oxpentifylline; Pentoxifilina; Pentoxifyllin; Pentoxifylline; Pentoxifyllinum
